{
  "schemaVersion": "1.0",
  "oeAnalyzerId": "fixture-analyzer-1",
  "profileRef": {
    "id": "fixture.profile",
    "revision": 2
  },
  "instance": {
    "name": "Laboratory analyzer A",
    "labUnitIds": ["lab-unit-1"],
    "connection": {
      "mode": "TCP",
      "settings": {
        "host": "192.0.2.10",
        "port": 5000,
        "credentialsRef": "secret/analyzers/fixture-analyzer-1"
      }
    }
  },
  "siteBinding": {
    "fingerprint": "sha256:1111111111111111111111111111111111111111111111111111111111111111",
    "tests": {
      "RAW-TEST-A": {
        "status": "BOUND",
        "openelisTestId": "local-test-1",
        "resultValues": {
          "RAW-POSITIVE": {
            "openelisResultOptionId": "local-result-option-1"
          }
        }
      },
      "RAW-TEST-B": {
        "status": "EXCLUDED",
        "reason": "Not offered by this laboratory"
      }
    }
  },
  "verification": {
    "verifiedBy": "fixture-user",
    "verifiedAt": "2026-08-19T12:00:00Z",
    "auditEventId": "audit-event-1",
    "profileRevisionFingerprint": "sha256:2222222222222222222222222222222222222222222222222222222222222222",
    "siteBindingFingerprint": "sha256:1111111111111111111111111111111111111111111111111111111111111111",
    "recognitionFingerprint": "sha256:3333333333333333333333333333333333333333333333333333333333333333"
  },
  "desiredRegistrationFingerprint": "sha256:4444444444444444444444444444444444444444444444444444444444444444",
  "bridgeAcknowledgement": {
    "status": "APPLIED",
    "profileRef": {
      "id": "fixture.profile",
      "revision": 2
    },
    "desiredStateFingerprint": "sha256:4444444444444444444444444444444444444444444444444444444444444444",
    "acknowledgedAt": "2026-08-19T12:01:00Z"
  }
}
